match_weight,match_probability,unique_id_l,unique_id_r,name_norm_l,name_norm_r,gamma_name_norm,bf_name_norm,pan_clean_l,pan_clean_r,gamma_pan_clean,bf_pan_clean,gstin_clean_l,gstin_clean_r,gamma_gstin_clean,bf_gstin_clean,addr_norm_l,addr_norm_r,gamma_addr_norm,bf_addr_norm,pin_code_l,pin_code_r,gamma_pin_code,bf_pin_code,match_key
14.933466242994022,0.999968043085355,BBMP/560100/0535,ESCOM/560100/000535,limited peoples pipes private,limited peoples pipes private,3,936.1370152025103,WMRFZ1994V,WMRFZ1994V,1,917.2573170641534,,,-1,1.0,"316 7, service road, kudlu gate, bangalore, 560100","316 7, service road, kudlu gate, bangalore, 560100",3,191.67213857035418,560100,560100,1,1.901026871008641,0
14.933466242994022,0.999968043085355,BBMP/560058/0558,KR/BN/00558/000,factory global metals,factory global metals,3,936.1370152025103,DKTHS9659C,DKTHS9659C,1,917.2573170641534,,29DKTHS9659C2Z8,-1,1.0,"service road, peenya industrial area, bangalore, bangalore","service road, peenya industrial area, bangalore, bangalore",3,191.67213857035418,560058,560058,1,1.901026871008641,0
14.933466242994022,0.999968043085355,BBMP/560100/0352,KR/BN/00352/000,company engineering sunrise,company engineering sunrise,3,936.1370152025103,UJDFC3955F,UJDFC3955F,1,917.2573170641534,29UJDFC3955F8ZH,,-1,1.0,"355 7, 2nd cross, bommanahalli, bangalore, 560100","355 7, 2nd cross, bommanahalli, bangalore, 560100",3,191.67213857035418,560100,560100,1,1.901026871008641,0
14.933466242994022,0.999968043085355,ESCOM/560058/000158,KR/BN/00158/000,group royal textiles,group royal textiles,3,936.1370152025103,ESGHV5033C,ESGHV5033C,1,917.2573170641534,,,-1,1.0,"657 7, cross road, rajajinagar industrial estate, bangalore, bangalore","657 7, cross road, rajajinagar industrial estate, bangalore, bangalore",3,191.67213857035418,560058,560058,1,1.901026871008641,0
14.933466242994022,0.999968043085355,BBMP/560058/0410,ESCOM/560058/000410,garments limited private srinivasa,garments limited private srinivasa,3,936.1370152025103,WFSHB9809S,WFSHB9809S,1,917.2573170641534,,,-1,1.0,"cross road, peenya industrial area, bangalore, 560058","cross road, peenya industrial area, bangalore, 560058",3,191.67213857035418,560058,560058,1,1.901026871008641,0
14.933466242994022,0.999968043085355,BBMP/560058/0469,KR/BN/00469/000,ceramics company mahalaxmi,ceramics company mahalaxmi,3,936.1370152025103,NCCAU0032O,NCCAU0032O,1,917.2573170641534,,,-1,1.0,"646 1, cross road, peenya, bangalore, 560058","646 1, cross road, peenya, bangalore, 560058",3,191.67213857035418,560058,560058,1,1.901026871008641,0
14.933466242994022,0.999968043085355,BBMP/560058/0103,KR/BN/00103/000,auto company new parts,auto company new parts,3,936.1370152025103,PDBCX2128Q,PDBCX2128Q,1,917.2573170641534,,,-1,1.0,"192 8, 3rd main, peenya 2nd stage, bangalore, 560058","192 8, 3rd main, peenya 2nd stage, bangalore, 560058",3,191.67213857035418,560058,560058,1,1.901026871008641,0
14.933466242994022,0.999968043085355,KAR/FACT/560100/0451,KR/BN/00451/000,company jsw paper,company jsw paper,3,936.1370152025103,YSJAK5980F,YSJAK5980F,1,917.2573170641534,,,-1,1.0,"129 1, industrial road, bommanahalli, bangalore, 560100","129 1, industrial road, bommanahalli, bangalore, 560100",3,191.67213857035418,560100,560100,1,1.901026871008641,0
14.933466242994022,0.999968043085355,BBMP/560058/0060,ESCOM/560058/000060,company plastics sunrise,company plastics sunrise,3,936.1370152025103,BDRHW2159P,BDRHW2159P,1,917.2573170641534,,29BDRHW2159P9Z0,-1,1.0,"industrial road, peenya industrial area, bangalore, 560058","industrial road, peenya industrial area, bangalore, 560058",3,191.67213857035418,560058,560058,1,1.901026871008641,0
14.933466242994022,0.999968043085355,BBMP/560058/0110,KR/BN/00110/000,chemicals global international,chemicals global international,3,936.1370152025103,SVIFH8267K,SVIFH8267K,1,917.2573170641534,,,-1,1.0,"2nd cross, yeshwanthpur, bangalore, bangalore","2nd cross, yeshwanthpur, bangalore, bangalore",3,191.67213857035418,560058,560058,1,1.901026871008641,0
14.933466242994022,0.999968043085355,BBMP/560058/0023,ESCOM/560058/000023,garments limited private wipro,garments limited private wipro,3,936.1370152025103,SUCHR2631F,SUCHR2631F,1,917.2573170641534,,,-1,1.0,"service road, peenya 2nd stage, bangalore, bangalore","service road, peenya 2nd stage, bangalore, bangalore",3,191.67213857035418,560058,560058,1,1.901026871008641,0
14.933466242994022,0.999968043085355,BBMP/560058/0435,KR/BN/00435/000,bangalore foods group,bangalore foods group,3,936.1370152025103,VLXAO1429R,VLXAO1429R,1,917.2573170641534,,,-1,1.0,"service road, bel road, bangalore, 560058","service road, bel road, bangalore, 560058",3,191.67213857035418,560058,560058,1,1.901026871008641,0
14.933466242994022,0.999968043085355,BBMP/560100/0072,KR/BN/00072/000,corporation electricals karnataka,corporation electricals karnataka,3,936.1370152025103,WUOFJ1069M,WUOFJ1069M,1,917.2573170641534,29WUOFJ1069M9ZS,,-1,1.0,"ring road, neeladri nagar, bangalore, 560100","ring road, neeladri nagar, bangalore, 560100",3,191.67213857035418,560100,560100,1,1.901026871008641,0
14.933466242994022,0.999968043085355,BBMP/560100/0412,KR/BN/00412/000,company furniture srinivasa,company furniture srinivasa,3,936.1370152025103,SGPFV2485D,SGPFV2485D,1,917.2573170641534,,,-1,1.0,"751 6, main road, hosur road, bangalore, 560100","751 6, main road, hosur road, bangalore, 560100",3,191.67213857035418,560100,560100,1,1.901026871008641,0
14.933466242994022,0.999968043085355,BBMP/560100/0178,KR/BN/00178/000,limited new plastics,limited new plastics,3,936.1370152025103,PIHPJ2352S,PIHPJ2352S,1,917.2573170641534,,,-1,1.0,"234 2, ring road, bommanahalli, bangalore, 560100","234 2, ring road, bommanahalli, bangalore, 560100",3,191.67213857035418,560100,560100,1,1.901026871008641,0
14.933466242994022,0.999968043085355,ESCOM/560058/000333,KR/BN/00333/000,chemicals corporation premier,chemicals corporation premier,3,936.1370152025103,ECRPO7830N,ECRPO7830N,1,917.2573170641534,29ECRPO7830N8ZE,,-1,1.0,"cross road, rajajinagar industrial estate, bangalore, 560058","cross road, rajajinagar industrial estate, bangalore, 560058",3,191.67213857035418,560058,560058,1,1.901026871008641,0
14.933466242994022,0.999968043085355,BBMP/560058/0313,KR/BN/00313/000,furniture limited national private,furniture limited national private,3,936.1370152025103,PBFPP3092V,PBFPP3092V,1,917.2573170641534,29PBFPP3092V8ZZ,,-1,1.0,"service road, peenya industrial area, bangalore, bangalore","service road, peenya industrial area, bangalore, bangalore",3,191.67213857035418,560058,560058,1,1.901026871008641,0
14.933466242994022,0.999968043085355,KAR/FACT/560058/0410,KR/BN/00410/000,garments limited private srinivasa,garments limited private srinivasa,3,936.1370152025103,WFSHB9809S,WFSHB9809S,1,917.2573170641534,,,-1,1.0,"841 7, cross road, peenya industrial area, bangalore, bangalore","841 7, cross road, peenya industrial area, bangalore, bangalore",3,191.67213857035418,560058,560058,1,1.901026871008641,0
14.933466242994022,0.999968043085355,ESCOM/560058/000313,KR/BN/00313/000,furniture limited national private,furniture limited national private,3,936.1370152025103,PBFPP3092V,PBFPP3092V,1,917.2573170641534,29PBFPP3092V8ZZ,,-1,1.0,"service road, peenya industrial area, bangalore, bangalore","service road, peenya industrial area, bangalore, bangalore",3,191.67213857035418,560058,560058,1,1.901026871008641,0
14.933466242994022,0.999968043085355,ESCOM/560058/000301,KR/BN/00301/000,cables factory ks,cables factory ks,3,936.1370152025103,NPYHQ0670X,NPYHQ0670X,1,917.2573170641534,29NPYHQ0670X1ZI,,-1,1.0,"main road, rajajinagar industrial estate, bangalore, 560058","main road, rajajinagar industrial estate, bangalore, 560058",3,191.67213857035418,560058,560058,1,1.901026871008641,0
14.933466242994022,0.999968043085355,BBMP/560058/0019,ESCOM/560058/000019,international pumps wipro,international pumps wipro,3,936.1370152025103,CVTFM6093X,CVTFM6093X,1,917.2573170641534,,,-1,1.0,"839 5, industrial road, peenya, bangalore, 560058","839 5, industrial road, peenya, bangalore, 560058",3,191.67213857035418,560058,560058,1,1.901026871008641,0
14.933466242994022,0.999968043085355,ESCOM/560100/000320,KR/BN/00320/000,electronics janatha limited private,electronics janatha limited private,3,936.1370152025103,TXJCX2039Y,TXJCX2039Y,1,917.2573170641534,29TXJCX2039Y8ZK,,-1,1.0,"750 7, cross road, kudlu gate, bangalore, 560100","750 7, cross road, kudlu gate, bangalore, 560100",3,191.67213857035418,560100,560100,1,1.901026871008641,0
14.933466242994022,0.999968043085355,KAR/FACT/560058/0283,KR/BN/00283/000,bangalore leather manufacturers,bangalore leather manufacturers,3,936.1370152025103,KQJCP8171M,KQJCP8171M,1,917.2573170641534,,,-1,1.0,"13 3, service road, peenya 2nd stage, bangalore, bangalore","13 3, service road, peenya 2nd stage, bangalore, bangalore",3,191.67213857035418,560058,560058,1,1.901026871008641,0
14.933466242994022,0.999968043085355,KAR/FACT/560058/0272,KR/BN/00272/000,ceramics limited new private,ceramics limited new private,3,936.1370152025103,HPDFR9019L,HPDFR9019L,1,917.2573170641534,29HPDFR9019L2Z4,,-1,1.0,"service road, yeshwanthpur, bangalore, 560058","service road, yeshwanthpur, bangalore, 560058",3,191.67213857035418,560058,560058,1,1.901026871008641,0
14.933466242994022,0.999968043085355,BBMP/560100/0084,ESCOM/560100/000084,indian limited private textiles,indian limited private textiles,3,936.1370152025103,DESHS7714O,DESHS7714O,1,917.2573170641534,,,-1,1.0,"ring road, electronic city phase 2, bangalore, 560100","ring road, electronic city phase 2, bangalore, 560100",3,191.67213857035418,560100,560100,1,1.901026871008641,0
14.933466242994022,0.999968043085355,ESCOM/560100/000559,KR/BN/00559/000,plastics shree traders,plastics shree traders,3,936.1370152025103,XWYFB7059H,XWYFB7059H,1,917.2573170641534,,,-1,1.0,"961 3, main road, kudlu gate, bangalore, bangalore","961 3, main road, kudlu gate, bangalore, bangalore",3,191.67213857035418,560100,560100,1,1.901026871008641,0
14.933466242994022,0.999968043085355,ESCOM/560100/000071,KR/BN/00071/000,chemicals traders united,chemicals traders united,3,936.1370152025103,GPLCP2847P,GPLCP2847P,1,917.2573170641534,,,-1,1.0,"2nd cross, neeladri nagar, bangalore, bangalore","2nd cross, neeladri nagar, bangalore, bangalore",3,191.67213857035418,560100,560100,1,1.901026871008641,0
14.933466242994022,0.999968043085355,BBMP/560100/0269,KR/BN/00269/000,enterprises mphasis plastics,enterprises mphasis plastics,3,936.1370152025103,PKRCC1475E,PKRCC1475E,1,917.2573170641534,29PKRCC1475E8ZJ,,-1,1.0,"main road, kudlu gate, bangalore, 560100","main road, kudlu gate, bangalore, 560100",3,191.67213857035418,560100,560100,1,1.901026871008641,0
14.933466242994022,0.999968043085355,BBMP/560100/0431,ESCOM/560100/000431,group pipes srinivasa,group pipes srinivasa,3,936.1370152025103,ZRFFH8922Y,ZRFFH8922Y,1,917.2573170641534,,,-1,1.0,"main road, electronic city phase 2, bangalore, 560100","main road, electronic city phase 2, bangalore, 560100",3,191.67213857035418,560100,560100,1,1.901026871008641,0
14.933466242994022,0.999968043085355,BBMP/560058/0253,KR/BN/00253/000,garments limited sri,garments limited sri,3,936.1370152025103,VTGPI2422G,VTGPI2422G,1,917.2573170641534,,,-1,1.0,"422 4, ring road, peenya, bangalore, 560058","422 4, ring road, peenya, bangalore, 560058",3,191.67213857035418,560058,560058,1,1.901026871008641,0
14.933466242994022,0.999968043085355,BBMP/560058/0418,KR/BN/00418/000,balaji electricals manufacturers,balaji electricals manufacturers,3,936.1370152025103,PAPFG7526N,PAPFG7526N,1,917.2573170641534,,29PAPFG7526N5ZB,-1,1.0,"251 1, 2nd cross, peenya 1st stage, bangalore, 560058","251 1, 2nd cross, peenya 1st stage, bangalore, 560058",3,191.67213857035418,560058,560058,1,1.901026871008641,0
14.933466242994022,0.999968043085355,ESCOM/560100/000092,KR/BN/00092/000,industries sri valves,industries sri valves,3,936.1370152025103,WKPFK4090V,WKPFK4090V,1,917.2573170641534,,,-1,1.0,"2nd cross, kudlu gate, bangalore, 560100","2nd cross, kudlu gate, bangalore, 560100",3,191.67213857035418,560100,560100,1,1.901026871008641,0
14.933466242994022,0.999968043085355,BBMP/560058/0249,KR/BN/00249/000,global leather limited private,global leather limited private,3,936.1370152025103,HGSCV2819I,HGSCV2819I,1,917.2573170641534,29HGSCV2819I4Z6,,-1,1.0,"973 8, main road, bel road, bangalore, 560058","973 8, main road, bel road, bangalore, 560058",3,191.67213857035418,560058,560058,1,1.901026871008641,0
14.933466242994022,0.999968043085355,ESCOM/560058/000249,KR/BN/00249/000,global leather limited private,global leather limited private,3,936.1370152025103,HGSCV2819I,HGSCV2819I,1,917.2573170641534,29HGSCV2819I4Z6,,-1,1.0,"973 8, main road, bel road, bangalore, 560058","973 8, main road, bel road, bangalore, 560058",3,191.67213857035418,560058,560058,1,1.901026871008641,0
14.933466242994022,0.999968043085355,KAR/FACT/560100/0244,KR/BN/00244/000,enterprises motors titan,enterprises motors titan,3,936.1370152025103,YNHFP1308J,YNHFP1308J,1,917.2573170641534,29YNHFP1308J2ZQ,,-1,1.0,"281 6, service road, electronic city phase 1, bangalore, 560100","281 6, service road, electronic city phase 1, bangalore, 560100",3,191.67213857035418,560100,560100,1,1.901026871008641,0
14.933466242994022,0.999968043085355,KAR/FACT/560100/0238,KR/BN/00238/000,engineering industries modern,engineering industries modern,3,936.1370152025103,OQOAX5818J,OQOAX5818J,1,917.2573170641534,,,-1,1.0,"factory road, bommanahalli, bangalore, bangalore","factory road, bommanahalli, bangalore, bangalore",3,191.67213857035418,560100,560100,1,1.901026871008641,0
14.933466242994022,0.999968043085355,BBMP/560058/0380,KR/BN/00380/000,beverages enterprises modern,beverages enterprises modern,3,936.1370152025103,XNYFO9516G,XNYFO9516G,1,917.2573170641534,29XNYFO9516G3ZV,,-1,1.0,"227 2, 3rd main, peenya 2nd stage, bangalore, 560058","227 2, 3rd main, peenya 2nd stage, bangalore, 560058",3,191.67213857035418,560058,560058,1,1.901026871008641,0
14.933466242994022,0.999968043085355,BBMP/560058/0364,KR/BN/00364/000,balaji corporation electronics,balaji corporation electronics,3,936.1370152025103,LNVFF1746E,LNVFF1746E,1,917.2573170641534,,29LNVFF1746E9ZF,-1,1.0,"main road, peenya 1st stage, bangalore, 560058","main road, peenya 1st stage, bangalore, 560058",3,191.67213857035418,560058,560058,1,1.901026871008641,0
14.933466242994022,0.999968043085355,BBMP/560100/0228,KR/BN/00228/000,factory mphasis printing,factory mphasis printing,3,936.1370152025103,NFOAL6197T,NFOAL6197T,1,917.2573170641534,,,-1,1.0,"1st cross, electronic city phase 1, bangalore, 560100","1st cross, electronic city phase 1, bangalore, 560100",3,191.67213857035418,560100,560100,1,1.901026871008641,0
14.933466242994022,0.999968043085355,ESCOM/560100/000384,KR/BN/00384/000,corporation indian pipes,corporation indian pipes,3,936.1370152025103,WHUAR6167Z,WHUAR6167Z,1,917.2573170641534,,,-1,1.0,"476 7, 3rd main, electronic city phase 2, bangalore, 560100","476 7, 3rd main, electronic city phase 2, bangalore, 560100",3,191.67213857035418,560100,560100,1,1.901026871008641,0
14.933466242994022,0.999968043085355,BBMP/560058/0503,ESCOM/560058/000503,company fabrics infosys,company fabrics infosys,3,936.1370152025103,HAWFA8469P,HAWFA8469P,1,917.2573170641534,,29HAWFA8469P1ZU,-1,1.0,"service road, bel road, bangalore, 560058","service road, bel road, bangalore, 560058",3,191.67213857035418,560058,560058,1,1.901026871008641,0
14.933466242994022,0.999968043085355,BBMP/560058/0079,KR/BN/00079/000,new textiles works,new textiles works,3,936.1370152025103,YJDHV1088C,YJDHV1088C,1,917.2573170641534,29YJDHV1088C7ZN,,-1,1.0,"545 2, 3rd main, peenya, bangalore, 560058","545 2, 3rd main, peenya, bangalore, 560058",3,191.67213857035418,560058,560058,1,1.901026871008641,0
14.933466242994022,0.999968043085355,KAR/FACT/560058/0170,KR/BN/00170/000,electricals limited private srinivasa,electricals limited private srinivasa,3,936.1370152025103,KJCFX6444I,KJCFX6444I,1,917.2573170641534,29KJCFX6444I4Z2,,-1,1.0,"488 3, industrial road, peenya industrial area, bangalore, bangalore","488 3, industrial road, peenya industrial area, bangalore, bangalore",3,191.67213857035418,560058,560058,1,1.901026871008641,0
14.933466242994022,0.999968043085355,BBMP/560100/0406,ESCOM/560100/000406,leather sri traders,leather sri traders,3,936.1370152025103,OUWAA1788S,OUWAA1788S,1,917.2573170641534,,,-1,1.0,"ring road, neeladri nagar, bangalore, 560100","ring road, neeladri nagar, bangalore, 560100",3,191.67213857035418,560100,560100,1,1.901026871008641,0
14.933466242994022,0.999968043085355,BBMP/560100/0405,KR/BN/00405/000,garments limited southern,garments limited southern,3,936.1370152025103,XXVFE7127U,XXVFE7127U,1,917.2573170641534,,,-1,1.0,"791 4, 3rd main, electronic city phase 1, bangalore, 560100","791 4, 3rd main, electronic city phase 1, bangalore, 560100",3,191.67213857035418,560100,560100,1,1.901026871008641,0
15.67411595533514,0.9999808745071354,ESCOM/560100/000666,KR/BN/00666/000,janatha limited private textiles,janatha limited p textiles,2,41.5494040363289,UGKFY8207N,UGKFY8207N,1,917.2573170641534,29UGKFY8207N8Z7,29UGKFY8207N8Z7,1,741.124716553288,"service road, electronic city phase 1, bangalore, 560100","service road, electronic city phase 1, bangalore, bangalore",2,9.736437711549554,560100,560100,1,1.901026871008641,0
15.67411595533514,0.9999808745071354,BBMP/560058/0480,KAR/FACT/560058/0480,manufacturer metals premier,manufacturers metals premier,2,41.5494040363289,KPGHQ0495Y,KPGHQ0495Y,1,917.2573170641534,29KPGHQ0495Y7Z2,29KPGHQ0495Y7Z2,1,741.124716553288,"420 2, cross road, peenya 1st stage, bangalore, 560058","420 2, cross road, peenya 1st stage, bangalore, bangalore",2,9.736437711549554,560058,560058,1,1.901026871008641,0
15.67411595533514,0.9999808745071354,ESCOM/560058/000480,KAR/FACT/560058/0480,manufacturer metals premier,manufacturers metals premier,2,41.5494040363289,KPGHQ0495Y,KPGHQ0495Y,1,917.2573170641534,29KPGHQ0495Y7Z2,29KPGHQ0495Y7Z2,1,741.124716553288,"420 2, cross road, peenya 1st stage, bangalore, 560058","420 2, cross road, peenya 1st stage, bangalore, bangalore",2,9.736437711549554,560058,560058,1,1.901026871008641,0
15.67411595533514,0.9999808745071354,BBMP/560100/0069,ESCOM/560100/000069,garments manufacturers peoples,garments manufacturing peoples,2,41.5494040363289,DXHCH9984T,DXHCH9984T,1,917.2573170641534,29DXHCH9984T1Z7,29DXHCH9984T1Z7,1,741.124716553288,"factory road, hosur road, bangalore, 560100","factory road, hosur road, bangalore, bangalore",2,9.736437711549554,560100,560100,1,1.901026871008641,0
15.67411595533514,0.9999808745071354,ESCOM/560100/000409,KR/BN/00409/000,manufacturing metals wipro,manufacturers metals wipro,2,41.5494040363289,BLIAB6456Z,BLIAB6456Z,1,917.2573170641534,29BLIAB6456Z3ZM,29BLIAB6456Z3ZM,1,741.124716553288,"ring road, kudlu gate, bangalore, bangalore","ring road, kudlu gate, bangalore, 560100",2,9.736437711549554,560100,560100,1,1.901026871008641,0
15.67411595533514,0.9999808745071354,BBMP/560100/0221,ESCOM/560100/000221,beverages infosys manufacturers,beverages infosys manufacturer,2,41.5494040363289,HZEHK1132C,HZEHK1132C,1,917.2573170641534,29HZEHK1132C3Z4,29HZEHK1132C3Z4,1,741.124716553288,"549 2, service road, bommanahalli, bangalore, 560100","549 2, service road, bommanahalli, bangalore, bangalore",2,9.736437711549554,560100,560100,1,1.901026871008641,0
17.11052324210117,0.9999929333075042,ESCOM/560058/000744,KAR/FACT/560058/0744,furniture group mphasis,furniture group mphasis,3,936.1370152025103,EZIPE7600T,EZIPE7600T,1,917.2573170641534,29EZIPE7600T3ZZ,29EZIPE7600T3ZZ,1,741.124716553288,"449 8, cross road, peenya 1st stage, bangalore, 560058","cross road, peenya 1st stage, bangalore, bangalore",1,1.169572505422142,560058,560058,1,1.901026871008641,0
17.11052324210117,0.9999929333075042,BBMP/560100/0742,KAR/FACT/560100/0742,bangalore enterprises textiles,bangalore enterprises textiles,3,936.1370152025103,HVTHK5682O,HVTHK5682O,1,917.2573170641534,29HVTHK5682O5ZW,29HVTHK5682O5ZW,1,741.124716553288,"688 5, industrial road, electronic city phase 2, bangalore, bangalore","industrial road, electronic city phase 2, bangalore, 560100",1,1.169572505422142,560100,560100,1,1.901026871008641,0
17.11052324210117,0.9999929333075042,BBMP/560058/0661,KAR/FACT/560058/0661,cables limited premier private,cables limited premier private,3,936.1370152025103,RAJAV8890I,RAJAV8890I,1,917.2573170641534,29RAJAV8890I4ZC,29RAJAV8890I4ZC,1,741.124716553288,"768 5, 3rd main, peenya 1st stage, bangalore, bangalore","3rd main, peenya 1st stage, bangalore, 560058",1,1.169572505422142,560058,560058,1,1.901026871008641,0
17.11052324210117,0.9999929333075042,BBMP/560100/0690,KAR/FACT/560100/0690,indian limited private pumps,indian limited private pumps,3,936.1370152025103,HXGHL4746H,HXGHL4746H,1,917.2573170641534,29HXGHL4746H9ZL,29HXGHL4746H9ZL,1,741.124716553288,"233 7, ring road, electronic city phase 1, bangalore, 560100","ring road, electronic city phase 1, bangalore, 560100",1,1.169572505422142,560100,560100,1,1.901026871008641,0
17.11052324210117,0.9999929333075042,ESCOM/560100/000690,KAR/FACT/560100/0690,indian limited private pumps,indian limited private pumps,3,936.1370152025103,HXGHL4746H,HXGHL4746H,1,917.2573170641534,29HXGHL4746H9ZL,29HXGHL4746H9ZL,1,741.124716553288,"233 7, ring road, electronic city phase 1, bangalore, bangalore","ring road, electronic city phase 1, bangalore, 560100",1,1.169572505422142,560100,560100,1,1.901026871008641,0
17.11052324210117,0.9999929333075042,ESCOM/560100/000688,KAR/FACT/560100/0688,enterprises foods premier,enterprises foods premier,3,936.1370152025103,HTQPC3442D,HTQPC3442D,1,917.2573170641534,29HTQPC3442D8ZX,29HTQPC3442D8ZX,1,741.124716553288,"205 5, industrial road, electronic city phase 1, bangalore, bangalore","industrial road, electronic city phase 1, bangalore, 560100",1,1.169572505422142,560100,560100,1,1.901026871008641,0
17.11052324210117,0.9999929333075042,BBMP/560058/0653,KAR/FACT/560058/0653,company janatha paper,company janatha paper,3,936.1370152025103,WPHCI8284K,WPHCI8284K,1,917.2573170641534,29WPHCI8284K9ZG,29WPHCI8284K9ZG,1,741.124716553288,"379 6, 3rd main, peenya 2nd stage, bangalore, 560058","3rd main, peenya 2nd stage, bangalore, 560058",1,1.169572505422142,560058,560058,1,1.901026871008641,0
17.11052324210117,0.9999929333075042,ESCOM/560058/000653,KAR/FACT/560058/0653,company janatha paper,company janatha paper,3,936.1370152025103,WPHCI8284K,WPHCI8284K,1,917.2573170641534,29WPHCI8284K9ZG,29WPHCI8284K9ZG,1,741.124716553288,"379 6, 3rd main, peenya 2nd stage, bangalore, 560058","3rd main, peenya 2nd stage, bangalore, 560058",1,1.169572505422142,560058,560058,1,1.901026871008641,0
17.11052324210117,0.9999929333075042,ESCOM/560100/000684,KAR/FACT/560100/0684,industries ks printing,industries ks printing,3,936.1370152025103,MGRFY7789H,MGRFY7789H,1,917.2573170641534,29MGRFY7789H6Z3,29MGRFY7789H6Z3,1,741.124716553288,"378 1, 2nd cross, electronic city phase 2, bangalore, 560100","2nd cross, electronic city phase 2, bangalore, 560100",1,1.169572505422142,560100,560100,1,1.901026871008641,0
17.11052324210117,0.9999929333075042,ESCOM/560100/000659,KAR/FACT/560100/0659,electronics ks limited,electronics ks limited,3,936.1370152025103,PPLPA1703L,PPLPA1703L,1,917.2573170641534,29PPLPA1703L1ZA,29PPLPA1703L1ZA,1,741.124716553288,"451 2, factory road, electronic city phase 2, bangalore, bangalore","factory road, electronic city phase 2, bangalore, 560100",1,1.169572505422142,560100,560100,1,1.901026871008641,0
17.11052324210117,0.9999929333075042,ESCOM/560058/000642,KAR/FACT/560058/0642,company motors royal,company motors royal,3,936.1370152025103,CMWCA3126X,CMWCA3126X,1,917.2573170641534,29CMWCA3126X8ZT,29CMWCA3126X8ZT,1,741.124716553288,"90 2, 2nd cross, rajajinagar industrial estate, bangalore, bangalore","2nd cross, rajajinagar industrial estate, bangalore, 560058",1,1.169572505422142,560058,560058,1,1.901026871008641,0
17.11052324210117,0.9999929333075042,BBMP/560058/0636,KAR/FACT/560058/0636,group infosys steel,group infosys steel,3,936.1370152025103,AKPHS4620T,AKPHS4620T,1,917.2573170641534,29AKPHS4620T4ZH,29AKPHS4620T4ZH,1,741.124716553288,"806 3, 2nd cross, peenya 1st stage, bangalore, bangalore","2nd cross, peenya 1st stage, bangalore, 560058",1,1.169572505422142,560058,560058,1,1.901026871008641,0
17.11052324210117,0.9999929333075042,ESCOM/560100/000646,KAR/FACT/560100/0646,limited motors private wipro,limited motors private wipro,3,936.1370152025103,DZOCM2382L,DZOCM2382L,1,917.2573170641534,29DZOCM2382L9ZP,29DZOCM2382L9ZP,1,741.124716553288,"ring road, electronic city phase 1, bangalore, 560100","163 6, ring road, electronic city phase 1, bangalore, 560100",1,1.169572505422142,560100,560100,1,1.901026871008641,0
17.11052324210117,0.9999929333075042,ESCOM/560100/000618,KAR/FACT/560100/0618,corporation valves venkateshwara,corporation valves venkateshwara,3,936.1370152025103,EZLAD5275P,EZLAD5275P,1,917.2573170641534,29EZLAD5275P7ZV,29EZLAD5275P7ZV,1,741.124716553288,"main road, electronic city phase 2, bangalore, bangalore","449 4, main road, electronic city phase 2, bangalore, bangalore",1,1.169572505422142,560100,560100,1,1.901026871008641,0
17.11052324210117,0.9999929333075042,ESCOM/560058/000609,KAR/FACT/560058/0609,cables new works,cables new works,3,936.1370152025103,TMCFR0843D,TMCFR0843D,1,917.2573170641534,29TMCFR0843D5ZZ,29TMCFR0843D5ZZ,1,741.124716553288,"623 4, 2nd cross, peenya 1st stage, bangalore, 560058","2nd cross, peenya 1st stage, bangalore, 560058",1,1.169572505422142,560058,560058,1,1.901026871008641,0
