match_weight,match_probability,unique_id_l,unique_id_r,name_norm_l,name_norm_r,gamma_name_norm,bf_name_norm,pan_clean_l,pan_clean_r,gamma_pan_clean,bf_pan_clean,gstin_clean_l,gstin_clean_r,gamma_gstin_clean,bf_gstin_clean,addr_norm_l,addr_norm_r,gamma_addr_norm,bf_addr_norm,pin_code_l,pin_code_r,gamma_pin_code,bf_pin_code,match_key
10.634363438225881,0.9993712695700858,BBMP/560058/0654,KR/BN/00654/000,bangalore company printing,bangalore company printing,3,936.1370152025103,ELHAF7193N,ELHAF7193N,1,917.2573170641534,,,-1,1.0,"96 1, 1st cross, peenya, bangalore, bangalore","96 1, 1st cross, peenya, bangalore, 560058",2,9.736437711549554,560058,560058,1,1.901026871008641,0
10.634363438225881,0.9993712695700858,BBMP/560100/0635,KR/BN/00635/000,electronics limited titan,electronics limited titan,3,936.1370152025103,SMTPN3502X,SMTPN3502X,1,917.2573170641534,,,-1,1.0,"2nd cross, bommanahalli, bangalore, 560100","2nd cross, bommanahalli, bangalore, bangalore",2,9.736437711549554,560100,560100,1,1.901026871008641,0
10.634363438225881,0.9993712695700858,ESCOM/560100/000635,KR/BN/00635/000,electronics limited titan,electronics limited titan,3,936.1370152025103,SMTPN3502X,SMTPN3502X,1,917.2573170641534,,,-1,1.0,"2nd cross, bommanahalli, bangalore, 560100","2nd cross, bommanahalli, bangalore, bangalore",2,9.736437711549554,560100,560100,1,1.901026871008641,0
10.634363438225881,0.9993712695700858,BBMP/560058/0643,KR/BN/00643/000,manufacturers new valves,manufacturers new valves,3,936.1370152025103,HBLPF4516D,HBLPF4516D,1,917.2573170641534,29HBLPF4516D2Z5,,-1,1.0,"ring road, bel road, bangalore, 560058","ring road, bel road, bangalore, bangalore",2,9.736437711549554,560058,560058,1,1.901026871008641,0
10.634363438225881,0.9993712695700858,BBMP/560058/0638,KR/BN/00638/000,enterprises printing southern,enterprises printing southern,3,936.1370152025103,EATPI3145Y,EATPI3145Y,1,917.2573170641534,,,-1,1.0,"445 4, service road, peenya, bangalore, bangalore","445 4, service road, peenya, bangalore, 560058",2,9.736437711549554,560058,560058,1,1.901026871008641,0
10.634363438225881,0.9993712695700858,BBMP/560058/0637,KR/BN/00637/000,premier traders valves,premier traders valves,3,936.1370152025103,VHFPB8652I,VHFPB8652I,1,917.2573170641534,,,-1,1.0,"3rd main, bel road, bangalore, 560058","3rd main, bel road, bangalore, bangalore",2,9.736437711549554,560058,560058,1,1.901026871008641,0
10.634363438225881,0.9993712695700858,BBMP/560100/0622,KR/BN/00622/000,company new pharmaceuticals,company new pharmaceuticals,3,936.1370152025103,RWRPK4270E,RWRPK4270E,1,917.2573170641534,,,-1,1.0,"service road, electronic city phase 1, bangalore, bangalore","service road, electronic city phase 1, bangalore, 560100",2,9.736437711549554,560100,560100,1,1.901026871008641,0
10.634363438225881,0.9993712695700858,KAR/FACT/560100/0608,KR/BN/00608/000,company electricals national,company electricals national,3,936.1370152025103,SSDPD0829E,SSDPD0829E,1,917.2573170641534,29SSDPD0829E4ZP,,-1,1.0,"service road, electronic city phase 2, bangalore, 560100","service road, electronic city phase 2, bangalore, bangalore",2,9.736437711549554,560100,560100,1,1.901026871008641,0
10.634363438225881,0.9993712695700858,BBMP/560100/0585,KR/BN/00585/000,cables infosys limited,cables infosys limited,3,936.1370152025103,PVMPA9925F,PVMPA9925F,1,917.2573170641534,,29PVMPA9925F6ZQ,-1,1.0,"687 6, service road, electronic city phase 2, bangalore, 560100","687 6, service road, electronic city phase 2, bangalore, bangalore",2,9.736437711549554,560100,560100,1,1.901026871008641,0
10.634363438225881,0.9993712695700858,BBMP/560100/0584,KR/BN/00584/000,group peoples plastics,group peoples plastics,3,936.1370152025103,VBCAZ7327R,VBCAZ7327R,1,917.2573170641534,,,-1,1.0,"25 9, industrial road, kudlu gate, bangalore, bangalore","25 9, industrial road, kudlu gate, bangalore, 560100",2,9.736437711549554,560100,560100,1,1.901026871008641,0
10.634363438225881,0.9993712695700858,KAR/FACT/560100/0528,KR/BN/00528/000,garments karnataka limited,garments karnataka limited,3,936.1370152025103,XJBPO1708D,XJBPO1708D,1,917.2573170641534,,,-1,1.0,"service road, hosur road, bangalore, 560100","service road, hosur road, bangalore, bangalore",2,9.736437711549554,560100,560100,1,1.901026871008641,0
10.634363438225881,0.9993712695700858,BBMP/560058/0540,KR/BN/00540/000,mphasis textiles works,mphasis textiles works,3,936.1370152025103,VRBHF5984K,VRBHF5984K,1,917.2573170641534,,29VRBHF5984K6ZY,-1,1.0,"2nd cross, rajajinagar industrial estate, bangalore, 560058","2nd cross, rajajinagar industrial estate, bangalore, bangalore",2,9.736437711549554,560058,560058,1,1.901026871008641,0
10.634363438225881,0.9993712695700858,BBMP/560058/0521,KR/BN/00521/000,company garments karnataka,company garments karnataka,3,936.1370152025103,MLRCV0432Z,MLRCV0432Z,1,917.2573170641534,,,-1,1.0,"factory road, bel road, bangalore, 560058","factory road, bel road, bangalore, bangalore",2,9.736437711549554,560058,560058,1,1.901026871008641,0
10.634363438225881,0.9993712695700858,ESCOM/560100/000492,KR/BN/00492/000,new printing traders,new printing traders,3,936.1370152025103,HLDPC9733N,HLDPC9733N,1,917.2573170641534,29HLDPC9733N4ZE,,-1,1.0,"491 2, ring road, electronic city phase 2, bangalore, bangalore","491 2, ring road, electronic city phase 2, bangalore, 560100",2,9.736437711549554,560100,560100,1,1.901026871008641,0
10.634363438225881,0.9993712695700858,ESCOM/560058/000510,KR/BN/00510/000,company lakshmi printing,company lakshmi printing,3,936.1370152025103,LHRHF2276F,LHRHF2276F,1,917.2573170641534,29LHRHF2276F7ZM,,-1,1.0,"819 8, service road, peenya 1st stage, bangalore, 560058","819 8, service road, peenya 1st stage, bangalore, bangalore",2,9.736437711549554,560058,560058,1,1.901026871008641,0
10.634363438225881,0.9993712695700858,ESCOM/560058/000505,KR/BN/00505/000,janatha printing works,janatha printing works,3,936.1370152025103,RXBFA4378P,RXBFA4378P,1,917.2573170641534,29RXBFA4378P5ZM,,-1,1.0,"720 7, ring road, peenya industrial area, bangalore, bangalore","720 7, ring road, peenya industrial area, bangalore, 560058",2,9.736437711549554,560058,560058,1,1.901026871008641,0
10.634363438225881,0.9993712695700858,BBMP/560100/0483,KR/BN/00483/000,chemicals international jsw,chemicals international jsw,3,936.1370152025103,SGGAH2044H,SGGAH2044H,1,917.2573170641534,29SGGAH2044H3Z3,,-1,1.0,"2nd cross, electronic city phase 2, bangalore, bangalore","2nd cross, electronic city phase 2, bangalore, 560100",2,9.736437711549554,560100,560100,1,1.901026871008641,0
10.634363438225881,0.9993712695700858,BBMP/560058/0503,KR/BN/00503/000,company fabrics infosys,company fabrics infosys,3,936.1370152025103,HAWFA8469P,HAWFA8469P,1,917.2573170641534,,29HAWFA8469P1ZU,-1,1.0,"service road, bel road, bangalore, 560058","service road, bel road, bangalore, bangalore",2,9.736437711549554,560058,560058,1,1.901026871008641,0
10.634363438225881,0.9993712695700858,BBMP/560100/0454,KR/BN/00454/000,limited motors united,limited motors united,3,936.1370152025103,MQAPN9166H,MQAPN9166H,1,917.2573170641534,,29MQAPN9166H5ZB,-1,1.0,"cross road, hosur road, bangalore, 560100","cross road, hosur road, bangalore, bangalore",2,9.736437711549554,560100,560100,1,1.901026871008641,0
10.634363438225881,0.9993712695700858,ESCOM/560058/000466,KR/BN/00466/000,balaji company paper,balaji company paper,3,936.1370152025103,SXNHH3433X,SXNHH3433X,1,917.2573170641534,29SXNHH3433X1ZD,,-1,1.0,"238 4, service road, yeshwanthpur, bangalore, bangalore","238 4, service road, yeshwanthpur, bangalore, 560058",2,9.736437711549554,560058,560058,1,1.901026871008641,0
10.634363438225881,0.9993712695700858,KAR/FACT/560058/0337,KR/BN/00337/000,electricals limited private southern,electricals limited private southern,3,936.1370152025103,SVAPY1398I,SVAPY1398I,1,917.2573170641534,,,-1,1.0,"705 1, 1st cross, yeshwanthpur, bangalore, 560058","705 1, 1st cross, yeshwanthpur, bangalore, bangalore",2,9.736437711549554,560058,560058,1,1.901026871008641,0
10.634363438225881,0.9993712695700858,BBMP/560058/0330,KR/BN/00330/000,ceramics limited modern private,ceramics limited modern private,3,936.1370152025103,HTMHA6819Q,HTMHA6819Q,1,917.2573170641534,,,-1,1.0,"257 1, ring road, peenya industrial area, bangalore, 560058","257 1, ring road, peenya industrial area, bangalore, bangalore",2,9.736437711549554,560058,560058,1,1.901026871008641,0
10.634363438225881,0.9993712695700858,ESCOM/560058/000315,KR/BN/00315/000,company leather premier,company leather premier,3,936.1370152025103,CXQCJ7471N,CXQCJ7471N,1,917.2573170641534,29CXQCJ7471N9Z1,,-1,1.0,"service road, peenya, bangalore, bangalore","service road, peenya, bangalore, 560058",2,9.736437711549554,560058,560058,1,1.901026871008641,0
10.634363438225881,0.9993712695700858,KAR/FACT/560058/0313,KR/BN/00313/000,furniture limited national private,furniture limited national private,3,936.1370152025103,PBFPP3092V,PBFPP3092V,1,917.2573170641534,29PBFPP3092V8ZZ,,-1,1.0,"service road, peenya industrial area, bangalore, 560058","service road, peenya industrial area, bangalore, bangalore",2,9.736437711549554,560058,560058,1,1.901026871008641,0
10.634363438225881,0.9993712695700858,ESCOM/560058/000296,KR/BN/00296/000,infosys limited rubber,infosys limited rubber,3,936.1370152025103,FOZPZ2558D,FOZPZ2558D,1,917.2573170641534,,,-1,1.0,"771 9, 3rd main, rajajinagar industrial estate, bangalore, 560058","771 9, 3rd main, rajajinagar industrial estate, bangalore, bangalore",2,9.736437711549554,560058,560058,1,1.901026871008641,0
10.634363438225881,0.9993712695700858,KAR/FACT/560058/0277,KR/BN/00277/000,balaji limited packaging private,balaji limited packaging private,3,936.1370152025103,RKBFA6260U,RKBFA6260U,1,917.2573170641534,,,-1,1.0,"factory road, rajajinagar industrial estate, bangalore, 560058","factory road, rajajinagar industrial estate, bangalore, bangalore",2,9.736437711549554,560058,560058,1,1.901026871008641,0
10.634363438225881,0.9993712695700858,ESCOM/560100/000293,KR/BN/00293/000,factory mahalaxmi motors,factory mahalaxmi motors,3,936.1370152025103,HZJCX7299W,HZJCX7299W,1,917.2573170641534,29HZJCX7299W9ZA,,-1,1.0,"3rd main, electronic city phase 1, bangalore, 560100","3rd main, electronic city phase 1, bangalore, bangalore",2,9.736437711549554,560100,560100,1,1.901026871008641,0
10.634363438225881,0.9993712695700858,BBMP/560058/0265,KR/BN/00265/000,corporation fabrics jsw,corporation fabrics jsw,3,936.1370152025103,ZNUHA0029H,ZNUHA0029H,1,917.2573170641534,,,-1,1.0,"2nd cross, peenya, bangalore, 560058","2nd cross, peenya, bangalore, bangalore",2,9.736437711549554,560058,560058,1,1.901026871008641,0
10.634363438225881,0.9993712695700858,ESCOM/560058/000265,KR/BN/00265/000,corporation fabrics jsw,corporation fabrics jsw,3,936.1370152025103,ZNUHA0029H,ZNUHA0029H,1,917.2573170641534,,,-1,1.0,"2nd cross, peenya, bangalore, 560058","2nd cross, peenya, bangalore, bangalore",2,9.736437711549554,560058,560058,1,1.901026871008641,0
10.634363438225881,0.9993712695700858,BBMP/560058/0259,KR/BN/00259/000,company printing venkateshwara,company printing venkateshwara,3,936.1370152025103,COOFI4989C,COOFI4989C,1,917.2573170641534,29COOFI4989C8ZM,,-1,1.0,"904 5, industrial road, peenya industrial area, bangalore, bangalore","904 5, industrial road, peenya industrial area, bangalore, 560058",2,9.736437711549554,560058,560058,1,1.901026871008641,0
10.634363438225881,0.9993712695700858,ESCOM/560100/000255,KR/BN/00255/000,balaji fabrics limited private,balaji fabrics limited private,3,936.1370152025103,TWPFG8849C,TWPFG8849C,1,917.2573170641534,29TWPFG8849C3ZL,,-1,1.0,"1st cross, electronic city phase 1, bangalore, bangalore","1st cross, electronic city phase 1, bangalore, 560100",2,9.736437711549554,560100,560100,1,1.901026871008641,0
10.634363438225881,0.9993712695700858,KAR/FACT/560058/0259,KR/BN/00259/000,company printing venkateshwara,company printing venkateshwara,3,936.1370152025103,COOFI4989C,COOFI4989C,1,917.2573170641534,29COOFI4989C8ZM,,-1,1.0,"904 5, industrial road, peenya industrial area, bangalore, bangalore","904 5, industrial road, peenya industrial area, bangalore, 560058",2,9.736437711549554,560058,560058,1,1.901026871008641,0
10.634363438225881,0.9993712695700858,ESCOM/560100/000238,KR/BN/00238/000,engineering industries modern,engineering industries modern,3,936.1370152025103,OQOAX5818J,OQOAX5818J,1,917.2573170641534,,,-1,1.0,"factory road, bommanahalli, bangalore, 560100","factory road, bommanahalli, bangalore, bangalore",2,9.736437711549554,560100,560100,1,1.901026871008641,0
10.634363438225881,0.9993712695700858,KAR/FACT/560100/0227,KR/BN/00227/000,bangalore foods manufacturers,bangalore foods manufacturers,3,936.1370152025103,OKUAK5578H,OKUAK5578H,1,917.2573170641534,,,-1,1.0,"cross road, neeladri nagar, bangalore, 560100","cross road, neeladri nagar, bangalore, bangalore",2,9.736437711549554,560100,560100,1,1.901026871008641,0
10.634363438225881,0.9993712695700858,BBMP/560058/0217,KR/BN/00217/000,garments international mahalaxmi,garments international mahalaxmi,3,936.1370152025103,OJDFE5931U,OJDFE5931U,1,917.2573170641534,,,-1,1.0,"ring road, rajajinagar industrial estate, bangalore, 560058","ring road, rajajinagar industrial estate, bangalore, bangalore",2,9.736437711549554,560058,560058,1,1.901026871008641,0
10.634363438225881,0.9993712695700858,BBMP/560100/0219,KR/BN/00219/000,company metals titan,company metals titan,3,936.1370152025103,JKQAH1758C,JKQAH1758C,1,917.2573170641534,,,-1,1.0,"3rd main, electronic city phase 1, bangalore, 560100","3rd main, electronic city phase 1, bangalore, bangalore",2,9.736437711549554,560100,560100,1,1.901026871008641,0
10.634363438225881,0.9993712695700858,ESCOM/560058/000217,KR/BN/00217/000,garments international mahalaxmi,garments international mahalaxmi,3,936.1370152025103,OJDFE5931U,OJDFE5931U,1,917.2573170641534,,,-1,1.0,"ring road, rajajinagar industrial estate, bangalore, 560058","ring road, rajajinagar industrial estate, bangalore, bangalore",2,9.736437711549554,560058,560058,1,1.901026871008641,0
10.634363438225881,0.9993712695700858,KAR/FACT/560058/0217,KR/BN/00217/000,garments international mahalaxmi,garments international mahalaxmi,3,936.1370152025103,OJDFE5931U,OJDFE5931U,1,917.2573170641534,,,-1,1.0,"ring road, rajajinagar industrial estate, bangalore, 560058","ring road, rajajinagar industrial estate, bangalore, bangalore",2,9.736437711549554,560058,560058,1,1.901026871008641,0
10.634363438225881,0.9993712695700858,BBMP/560100/0215,KR/BN/00215/000,fabrics limited national,fabrics limited national,3,936.1370152025103,RVXAL3793H,RVXAL3793H,1,917.2573170641534,,29RVXAL3793H2ZD,-1,1.0,"1st cross, kudlu gate, bangalore, bangalore","1st cross, kudlu gate, bangalore, 560100",2,9.736437711549554,560100,560100,1,1.901026871008641,0
10.634363438225881,0.9993712695700858,ESCOM/560058/000210,KR/BN/00210/000,factory jsw textiles,factory jsw textiles,3,936.1370152025103,QXZFY1514T,QXZFY1514T,1,917.2573170641534,29QXZFY1514T9ZT,,-1,1.0,"253 4, service road, peenya, bangalore, 560058","253 4, service road, peenya, bangalore, bangalore",2,9.736437711549554,560058,560058,1,1.901026871008641,0
10.634363438225881,0.9993712695700858,ESCOM/560058/000207,KR/BN/00207/000,beverages sri works,beverages sri works,3,936.1370152025103,MFFFY1935C,MFFFY1935C,1,917.2573170641534,,,-1,1.0,"353 2, 3rd main, peenya industrial area, bangalore, bangalore","3rd main, peenya industrial area, bangalore, bangalore",2,9.736437711549554,560058,560058,1,1.901026871008641,0
10.634363438225881,0.9993712695700858,BBMP/560100/0189,KR/BN/00189/000,international national paints,international national paints,3,936.1370152025103,PHMFW8212T,PHMFW8212T,1,917.2573170641534,,29PHMFW8212T7ZB,-1,1.0,"731 1, factory road, bommanahalli, bangalore, bangalore","731 1, factory road, bommanahalli, bangalore, 560100",2,9.736437711549554,560100,560100,1,1.901026871008641,0
10.634363438225881,0.9993712695700858,ESCOM/560058/000170,KR/BN/00170/000,electricals limited private srinivasa,electricals limited private srinivasa,3,936.1370152025103,KJCFX6444I,KJCFX6444I,1,917.2573170641534,29KJCFX6444I4Z2,,-1,1.0,"488 3, industrial road, peenya industrial area, bangalore, 560058","488 3, industrial road, peenya industrial area, bangalore, bangalore",2,9.736437711549554,560058,560058,1,1.901026871008641,0
10.634363438225881,0.9993712695700858,BBMP/560100/0179,KR/BN/00179/000,corporation infosys valves,corporation infosys valves,3,936.1370152025103,FHQFZ0046S,FHQFZ0046S,1,917.2573170641534,29FHQFZ0046S4Z8,,-1,1.0,"2nd cross, hosur road, bangalore, bangalore","2nd cross, hosur road, bangalore, 560100",2,9.736437711549554,560100,560100,1,1.901026871008641,0
10.634363438225881,0.9993712695700858,ESCOM/560058/000166,KR/BN/00166/000,chemicals company jsw,chemicals company jsw,3,936.1370152025103,PIPCX4483N,PIPCX4483N,1,917.2573170641534,,,-1,1.0,"main road, peenya, bangalore, 560058","main road, peenya, bangalore, bangalore",2,9.736437711549554,560058,560058,1,1.901026871008641,0
10.634363438225881,0.9993712695700858,BBMP/560100/0054,KR/BN/00054/000,limited national pharmaceuticals,limited national pharmaceuticals,3,936.1370152025103,BYRHG7884M,BYRHG7884M,1,917.2573170641534,,,-1,1.0,"267 3, factory road, electronic city phase 2, bangalore, 560100","267 3, factory road, electronic city phase 2, bangalore, bangalore",2,9.736437711549554,560100,560100,1,1.901026871008641,0
10.634363438225881,0.9993712695700858,KAR/FACT/560100/0054,KR/BN/00054/000,limited national pharmaceuticals,limited national pharmaceuticals,3,936.1370152025103,BYRHG7884M,BYRHG7884M,1,917.2573170641534,,,-1,1.0,"267 3, factory road, electronic city phase 2, bangalore, 560100","267 3, factory road, electronic city phase 2, bangalore, bangalore",2,9.736437711549554,560100,560100,1,1.901026871008641,0
10.634363438225881,0.9993712695700858,ESCOM/560100/000041,KR/BN/00041/000,fabrics factory sri,fabrics factory sri,3,936.1370152025103,JWYFK3262T,JWYFK3262T,1,917.2573170641534,29JWYFK3262T2ZU,,-1,1.0,"370 3, 1st cross, neeladri nagar, bangalore, bangalore","370 3, 1st cross, neeladri nagar, bangalore, 560100",2,9.736437711549554,560100,560100,1,1.901026871008641,0
10.634363438225881,0.9993712695700858,BBMP/560100/0677,ESCOM/560100/000677,company indian valves,company indian valves,3,936.1370152025103,TZJCM2759B,TZJCM2759B,1,917.2573170641534,,,-1,1.0,"3rd main, electronic city phase 2, bangalore, 560100","3rd main, electronic city phase 2, bangalore, bangalore",2,9.736437711549554,560100,560100,1,1.901026871008641,0
10.634363438225881,0.9993712695700858,BBMP/560058/0648,ESCOM/560058/000648,corporation foods sunrise,corporation foods sunrise,3,936.1370152025103,AACAE5061V,AACAE5061V,1,917.2573170641534,,29AACAE5061V5Z3,-1,1.0,"763 8, service road, peenya 1st stage, bangalore, 560058","763 8, service road, peenya 1st stage, bangalore, bangalore",2,9.736437711549554,560058,560058,1,1.901026871008641,0
10.634363438225881,0.9993712695700858,BBMP/560058/0647,ESCOM/560058/000647,manufacturers national textiles,manufacturers national textiles,3,936.1370152025103,ZDDCC0645X,ZDDCC0645X,1,917.2573170641534,,,-1,1.0,"3rd main, rajajinagar industrial estate, bangalore, bangalore","3rd main, rajajinagar industrial estate, bangalore, 560058",2,9.736437711549554,560058,560058,1,1.901026871008641,0
10.634363438225881,0.9993712695700858,BBMP/560100/0660,ESCOM/560100/000660,ceramics group janatha,ceramics group janatha,3,936.1370152025103,BWQPM0113Z,BWQPM0113Z,1,917.2573170641534,,,-1,1.0,"2nd cross, hosur road, bangalore, bangalore","2nd cross, hosur road, bangalore, 560100",2,9.736437711549554,560100,560100,1,1.901026871008641,0
10.634363438225881,0.9993712695700858,BBMP/560058/0637,ESCOM/560058/000637,premier traders valves,premier traders valves,3,936.1370152025103,VHFPB8652I,VHFPB8652I,1,917.2573170641534,,,-1,1.0,"3rd main, bel road, bangalore, 560058","3rd main, bel road, bangalore, bangalore",2,9.736437711549554,560058,560058,1,1.901026871008641,0
10.634363438225881,0.9993712695700858,BBMP/560100/0631,ESCOM/560100/000631,balaji enterprises printing,balaji enterprises printing,3,936.1370152025103,WBCHP4484T,WBCHP4484T,1,917.2573170641534,,,-1,1.0,"factory road, neeladri nagar, bangalore, 560100","factory road, neeladri nagar, bangalore, bangalore",2,9.736437711549554,560100,560100,1,1.901026871008641,0
10.634363438225881,0.9993712695700858,BBMP/560100/0588,ESCOM/560100/000588,manufacturers plastics shree,manufacturers plastics shree,3,936.1370152025103,PVZPZ4431N,PVZPZ4431N,1,917.2573170641534,,29PVZPZ4431N2Z4,-1,1.0,"ring road, bommanahalli, bangalore, 560100","ring road, bommanahalli, bangalore, bangalore",2,9.736437711549554,560100,560100,1,1.901026871008641,0
10.634363438225881,0.9993712695700858,BBMP/560100/0584,ESCOM/560100/000584,group peoples plastics,group peoples plastics,3,936.1370152025103,VBCAZ7327R,VBCAZ7327R,1,917.2573170641534,,,-1,1.0,"25 9, industrial road, kudlu gate, bangalore, bangalore","25 9, industrial road, kudlu gate, bangalore, 560100",2,9.736437711549554,560100,560100,1,1.901026871008641,0
10.634363438225881,0.9993712695700858,BBMP/560100/0559,ESCOM/560100/000559,plastics shree traders,plastics shree traders,3,936.1370152025103,XWYFB7059H,XWYFB7059H,1,917.2573170641534,,,-1,1.0,"961 3, main road, kudlu gate, bangalore, 560100","961 3, main road, kudlu gate, bangalore, bangalore",2,9.736437711549554,560100,560100,1,1.901026871008641,0
10.634363438225881,0.9993712695700858,BBMP/560100/0394,ESCOM/560100/000394,enterprises furniture ks,enterprises furniture ks,3,936.1370152025103,OYNAO6558Q,OYNAO6558Q,1,917.2573170641534,,,-1,1.0,"factory road, kudlu gate, bangalore, bangalore","factory road, kudlu gate, bangalore, 560100",2,9.736437711549554,560100,560100,1,1.901026871008641,0
10.634363438225881,0.9993712695700858,BBMP/560100/0384,ESCOM/560100/000384,corporation indian pipes,corporation indian pipes,3,936.1370152025103,WHUAR6167Z,WHUAR6167Z,1,917.2573170641534,,,-1,1.0,"476 7, 3rd main, electronic city phase 2, bangalore, bangalore","476 7, 3rd main, electronic city phase 2, bangalore, 560100",2,9.736437711549554,560100,560100,1,1.901026871008641,0
10.634363438225881,0.9993712695700858,BBMP/560058/0297,ESCOM/560058/000297,chemicals industries sri,chemicals industries sri,3,936.1370152025103,SGFPN0742C,SGFPN0742C,1,917.2573170641534,,,-1,1.0,"111 7, ring road, peenya 2nd stage, bangalore, 560058","111 7, ring road, peenya 2nd stage, bangalore, bangalore",2,9.736437711549554,560058,560058,1,1.901026871008641,0
10.634363438225881,0.9993712695700858,BBMP/560100/0323,ESCOM/560100/000323,group motors southern,group motors southern,3,936.1370152025103,LPBCY5962G,LPBCY5962G,1,917.2573170641534,,,-1,1.0,"373 5, industrial road, hosur road, bangalore, bangalore","373 5, industrial road, hosur road, bangalore, 560100",2,9.736437711549554,560100,560100,1,1.901026871008641,0
10.634363438225881,0.9993712695700858,BBMP/560100/0305,ESCOM/560100/000305,corporation karnataka paper,corporation karnataka paper,3,936.1370152025103,YWGFO5446V,YWGFO5446V,1,917.2573170641534,,,-1,1.0,"184 5, 1st cross, bommanahalli, bangalore, 560100","184 5, 1st cross, bommanahalli, bangalore, bangalore",2,9.736437711549554,560100,560100,1,1.901026871008641,0
10.634363438225881,0.9993712695700858,BBMP/560058/0252,ESCOM/560058/000252,global international pumps,global international pumps,3,936.1370152025103,OBCAF5865Y,OBCAF5865Y,1,917.2573170641534,,,-1,1.0,"197 9, cross road, bel road, bangalore, 560058","197 9, cross road, bel road, bangalore, bangalore",2,9.736437711549554,560058,560058,1,1.901026871008641,0
10.634363438225881,0.9993712695700858,BBMP/560058/0004,ESCOM/560058/000004,engineering limited private wipro,engineering limited private wipro,3,936.1370152025103,WIMCH8181C,WIMCH8181C,1,917.2573170641534,,29WIMCH8181C1Z3,-1,1.0,"179 3, 1st cross, peenya, bangalore, bangalore","179 3, 1st cross, peenya, bangalore, 560058",2,9.736437711549554,560058,560058,1,1.901026871008641,0
10.634363438225881,0.9993712695700858,BBMP/560100/0043,ESCOM/560100/000043,fabrics manufacturers sunrise,fabrics manufacturers sunrise,3,936.1370152025103,QDEPH7822P,QDEPH7822P,1,917.2573170641534,,29QDEPH7822P5ZD,-1,1.0,"2nd cross, electronic city phase 1, bangalore, bangalore","2nd cross, electronic city phase 1, bangalore, 560100",2,9.736437711549554,560100,560100,1,1.901026871008641,0
10.634363438225881,0.9993712695700858,BBMP/560100/0419,KAR/FACT/560100/0419,ceramics karnataka limited,ceramics karnataka limited,3,936.1370152025103,RUXFO7408J,RUXFO7408J,1,917.2573170641534,,29RUXFO7408J2ZQ,-1,1.0,"100 4, ring road, electronic city phase 2, bangalore, 560100","100 4, ring road, electronic city phase 2, bangalore, bangalore",2,9.736437711549554,560100,560100,1,1.901026871008641,0
10.634363438225881,0.9993712695700858,ESCOM/560100/000528,KAR/FACT/560100/0528,garments karnataka limited,garments karnataka limited,3,936.1370152025103,XJBPO1708D,XJBPO1708D,1,917.2573170641534,,,-1,1.0,"service road, hosur road, bangalore, bangalore","service road, hosur road, bangalore, 560100",2,9.736437711549554,560100,560100,1,1.901026871008641,0
10.634363438225881,0.9993712695700858,ESCOM/560100/000172,KR/BN/00172/000,auto bangalore manufacturers parts,auto bangalore manufacturers parts,3,936.1370152025103,BHNHY1962K,BHNHY1962K,1,917.2573170641534,29BHNHY1962K4ZQ,,-1,1.0,"632 1, factory road, hosur road, bangalore, 560100","632 1, factory road, hosur road, bangalore, bangalore",2,9.736437711549554,560100,560100,1,1.901026871008641,0
10.634363438225881,0.9993712695700858,ESCOM/560100/000165,KAR/FACT/560100/0165,corporation paints star,corporation paints star,3,936.1370152025103,PIDCE9924D,PIDCE9924D,1,917.2573170641534,,,-1,1.0,"733 5, main road, electronic city phase 2, bangalore, bangalore","733 5, main road, electronic city phase 2, bangalore, 560100",2,9.736437711549554,560100,560100,1,1.901026871008641,0
