unique_id,business_name,address,pin_code,pan,gstin,source_system,name_norm,addr_norm,pan_valid,gstin_valid,pan_clean,gstin_clean
BBMP/560100/0584,Plastics Peoples Group,"25/9, Industrial Road, Kudlu Gate, Bengaluru, B'lore",560100,VBCAZ7327R,,BBMP,group peoples plastics,"25 9, industrial road, kudlu gate, bangalore, bangalore",True,False,VBCAZ7327R,
BBMP/560100/0585,Infosys Cables Limited,"687/6, Service Road, Electronic City Phase 2, Bengaluru, 560100",560100,PVMPA9925F,,BBMP,cables infosys limited,"687 6, service road, electronic city phase 2, bangalore, 560100",True,False,PVMPA9925F,
BBMP/560058/0586,New Paper & Co,"28/6, Main Road, Peenya, Bengaluru, 560058",560058,,,BBMP,company new paper,"28 6, main road, peenya, bangalore, 560058",False,False,,
BBMP/560100/0588,Shree Plastics Mfrs,"Ring Road, Bommanahalli, Bengaluru, 560100",560100,PVZPZ4431N,,BBMP,manufacturers plastics shree,"ring road, bommanahalli, bangalore, 560100",True,False,PVZPZ4431N,
BBMP/560058/0589,Modern Rubber & Co,"Cross Road, Rajajinagar Industrial Estate, Bengaluru, B'lore",560058,,,BBMP,company modern rubber,"cross road, rajajinagar industrial estate, bangalore, bangalore",False,False,,
BBMP/560100/0590,Indian Pumps Mfg,"Main Road, Kudlu Gate, Bengaluru, 560100",560100,AGNCS2437L,29AGNCS2437L1ZS,BBMP,indian manufacturing pumps,"main road, kudlu gate, bangalore, 560100",True,True,AGNCS2437L,29AGNCS2437L1ZS
BBMP/560058/0591,Janatha Pumps Ltd,"3rd Main, Yeshwanthpur, Bengaluru, 560058",560058,PXSAL6356Y,,BBMP,janatha limited pumps,"3rd main, yeshwanthpur, bangalore, 560058",True,False,PXSAL6356Y,
BBMP/560058/0593,United Ceramics Pvt Ltd,"914/3, 1st Cross, Rajajinagar Industrial Estate, Bengaluru, 560058",560058,,,BBMP,ceramics limited private united,"914 3, 1st cross, rajajinagar industrial estate, bangalore, 560058",False,False,,
BBMP/560058/0594,Indian Foundry Co,"3rd Main, Peenya 1st Stage, Bengaluru, 560058",560058,,,BBMP,company foundry indian,"3rd main, peenya 1st stage, bangalore, 560058",False,False,,
BBMP/560100/0595,Royal Garments Private Limited,"Industrial Road, Bommanahalli, Bengaluru, 560100",560100,SDPHR5356C,,BBMP,garments limited private royal,"industrial road, bommanahalli, bangalore, 560100",True,False,SDPHR5356C,
BBMP/560058/0597,Srinivasa Paper International,"Cross Road, BEL Road, Bengaluru, B'lore",560058,AHDHG0164L,,BBMP,international paper srinivasa,"cross road, bel road, bangalore, bangalore",True,False,AHDHG0164L,
BBMP/560100/0598,Shree Beverages Enterprises,"618/3, Service Road, Neeladri Nagar, Bengaluru, 560100",560100,KNFCO2987P,29KNFCO2987P1ZZ,BBMP,beverages enterprises shree,"618 3, service road, neeladri nagar, bangalore, 560100",True,True,KNFCO2987P,29KNFCO2987P1ZZ
BBMP/560058/0600,Lakshmi Electricals Works,"Main Road, Peenya 2nd Stage, Bengaluru, B'lore",560058,PADHP7599D,29PADHP7599D9ZF,BBMP,electricals lakshmi works,"main road, peenya 2nd stage, bangalore, bangalore",True,True,PADHP7599D,29PADHP7599D9ZF
BBMP/560100/0603,Pipes Mphasis Co,"Service Road, Neeladri Nagar, Bengaluru, B'lore",560100,ZQMPQ4519J,29ZQMPQ4519J6ZM,BBMP,company mphasis pipes,"service road, neeladri nagar, bangalore, bangalore",True,True,ZQMPQ4519J,29ZQMPQ4519J6ZM
BBMP/560100/0604,Global Beverages Ltd,"Cross Road, Electronic City Phase 1, Bengaluru, B'lore",560100,,,BBMP,beverages global limited,"cross road, electronic city phase 1, bangalore, bangalore",False,False,,
BBMP/560058/0605,Mahalaxmi Plastics & Co,"3rd Main, Peenya Industrial Area, Bengaluru, B'lore",560058,ONIHS6774H,29ONIHS6774H7Z5,BBMP,company mahalaxmi plastics,"3rd main, peenya industrial area, bangalore, bangalore",True,True,ONIHS6774H,29ONIHS6774H7Z5
BBMP/560058/0606,Janatha Cables Ind,"Cross Road, Rajajinagar Industrial Estate, Bengaluru, B'lore",560058,,,BBMP,cables industries janatha,"cross road, rajajinagar industrial estate, bangalore, bangalore",False,False,,
BBMP/560058/0607,Mahalaxmi Pharmaceuticals Corporation,"197/7, Service Road, Peenya Industrial Area, Bengaluru, 560058",560058,GIPCW6858C,29GIPCW6858C5ZQ,BBMP,corporation mahalaxmi pharmaceuticals,"197 7, service road, peenya industrial area, bangalore, 560058",True,True,GIPCW6858C,29GIPCW6858C5ZQ
BBMP/560100/0608,Electricals National & Co,"842/7, Service Road, Electronic City Phase 2, Bengaluru, 560100",560100,SSDPD0829E,29SSDPD0829E4ZP,BBMP,company electricals national,"842 7, service road, electronic city phase 2, bangalore, 560100",True,True,SSDPD0829E,29SSDPD0829E4ZP
BBMP/560058/0610,Royal Plastics International,"541/4, 1st Cross, Peenya 2nd Stage, Bengaluru, B'lore",560058,,,BBMP,international plastics royal,"541 4, 1st cross, peenya 2nd stage, bangalore, bangalore",False,False,,
BBMP/560100/0611,Venkateshwara Plastics Corporation,"Service Road, Hosur Road, Bengaluru, 560100",560100,,,BBMP,corporation plastics venkateshwara,"service road, hosur road, bangalore, 560100",False,False,,
BBMP/560100/0613,Premier Electronics Pvt. Ltd.,"2nd Cross, Electronic City Phase 2, Bengaluru, 560100",560100,LOLFF8264L,29LOLFF8264L2ZK,BBMP,electronics limited premier private,"2nd cross, electronic city phase 2, bangalore, 560100",True,True,LOLFF8264L,29LOLFF8264L2ZK
BBMP/560058/0614,Motors Bangalore Traders,"49/9, Main Road, Peenya 2nd Stage, Bengaluru, B'lore",560058,RGMPV7994F,29RGMPV7994F4ZP,BBMP,bangalore motors traders,"49 9, main road, peenya 2nd stage, bangalore, bangalore",True,True,RGMPV7994F,29RGMPV7994F4ZP
BBMP/560058/0616,Wipro Electronics Manufacturers,"2nd Cross, Peenya 2nd Stage, Bengaluru, 560058",560058,NNQPA9164N,29NNQPA9164N4ZG,BBMP,electronics manufacturers wipro,"2nd cross, peenya 2nd stage, bangalore, 560058",True,True,NNQPA9164N,29NNQPA9164N4ZG
BBMP/560058/0617,Peoples Packaging Factory,"480/9, Main Road, Peenya 2nd Stage, Bengaluru, B'lore",560058,ULHCE0562K,29ULHCE0562K3ZV,BBMP,factory packaging peoples,"480 9, main road, peenya 2nd stage, bangalore, bangalore",True,True,ULHCE0562K,29ULHCE0562K3ZV
BBMP/560100/0618,Venkateshwara Valves Corporation,"449/4, Main Road, Electronic City Phase 2, Bengaluru, 560100",560100,EZLAD5275P,29EZLAD5275P7ZV,BBMP,corporation valves venkateshwara,"449 4, main road, electronic city phase 2, bangalore, 560100",True,True,EZLAD5275P,29EZLAD5275P7ZV
BBMP/560100/0620,Beverages Titan Works,"476/4, 3rd Main, Bommanahalli, Bengaluru, 560100",560100,FCLFX2370N,,BBMP,beverages titan works,"476 4, 3rd main, bommanahalli, bangalore, 560100",True,False,FCLFX2370N,
BBMP/560058/0621,Titan Valves Works,"Factory Road, Peenya, Bengaluru, B'lore",560058,,,BBMP,titan valves works,"factory road, peenya, bangalore, bangalore",False,False,,
BBMP/560100/0622,New Pharmaceuticals Co,"Service Road, Electronic City Phase 1, Bengaluru, B'lore",560100,RWRPK4270E,,BBMP,company new pharmaceuticals,"service road, electronic city phase 1, bangalore, bangalore",True,False,RWRPK4270E,
BBMP/560100/0623,Textiles Modern Corporation,"400/7, Cross Road, Electronic City Phase 2, Bengaluru, B'lore",560100,IHLPB5756O,29IHLPB5756O7Z2,BBMP,corporation modern textiles,"400 7, cross road, electronic city phase 2, bangalore, bangalore",True,True,IHLPB5756O,29IHLPB5756O7Z2
BBMP/560100/0624,Karnataka Valves Works,"3rd Main, Neeladri Nagar, Bengaluru, 560100",560100,NPWPI5054O,29NPWPI5054O7Z5,BBMP,karnataka valves works,"3rd main, neeladri nagar, bangalore, 560100",True,True,NPWPI5054O,29NPWPI5054O7Z5
BBMP/560100/0626,Garments United Limited,"Factory Road, Bommanahalli, Bengaluru, B'lore",560100,JHAAH9902D,29JHAAH9902D3Z9,BBMP,garments limited united,"factory road, bommanahalli, bangalore, bangalore",True,True,JHAAH9902D,29JHAAH9902D3Z9
BBMP/560058/0627,Beverages Sunrise Mfr,"385/9, Ring Road, Rajajinagar Industrial Estate, Bengaluru, B'lore",560058,IBEFV9549N,,BBMP,beverages manufacturer sunrise,"385 9, ring road, rajajinagar industrial estate, bangalore, bangalore",True,False,IBEFV9549N,
BBMP/560058/0628,Global Electricals & Co,"Cross Road, Peenya, Bengaluru, 560058",560058,MFOPX0272K,29MFOPX0272K4ZZ,BBMP,company electricals global,"cross road, peenya, bangalore, 560058",True,True,MFOPX0272K,29MFOPX0272K4ZZ
BBMP/560058/0629,Karnataka Beverages Private Limited,"3rd Main, Yeshwanthpur, Bengaluru, B'lore",560058,,,BBMP,beverages karnataka limited private,"3rd main, yeshwanthpur, bangalore, bangalore",False,False,,
BBMP/560058/0630,Balaji Electricals Industries,"Service Road, Peenya Industrial Area, Bengaluru, 560058",560058,KOLPL0500F,29KOLPL0500F2Z7,BBMP,balaji electricals industries,"service road, peenya industrial area, bangalore, 560058",True,True,KOLPL0500F,29KOLPL0500F2Z7
BBMP/560100/0631,Balaji Printing Enterprises,"Factory Road, Neeladri Nagar, Bengaluru, 560100",560100,WBCHP4484T,,BBMP,balaji enterprises printing,"factory road, neeladri nagar, bangalore, 560100",True,False,WBCHP4484T,
BBMP/560100/0632,Pipes Bengaluru Pvt Ltd,"3rd Main, Neeladri Nagar, Bengaluru, 560100",560100,TCFPI6469H,,BBMP,bangalore limited pipes private,"3rd main, neeladri nagar, bangalore, 560100",True,False,TCFPI6469H,
BBMP/560058/0633,Southern Garments Group,"2nd Cross, Peenya 1st Stage, Bengaluru, B'lore",560058,WXJFN9775M,,BBMP,garments group southern,"2nd cross, peenya 1st stage, bangalore, bangalore",True,False,WXJFN9775M,
BBMP/560100/0634,Royal Pipes International,"139/2, 1st Cross, Neeladri Nagar, Bengaluru, 560100",560100,MGBHM6152S,29MGBHM6152S1Z6,BBMP,international pipes royal,"139 2, 1st cross, neeladri nagar, bangalore, 560100",True,True,MGBHM6152S,29MGBHM6152S1Z6
BBMP/560100/0635,Electronics Titan Limited,"2nd Cross, Bommanahalli, Bengaluru, 560100",560100,SMTPN3502X,,BBMP,electronics limited titan,"2nd cross, bommanahalli, bangalore, 560100",True,False,SMTPN3502X,
BBMP/560058/0636,Steel Infosys Group,"806/3, 2nd Cross, Peenya 1st Stage, Bengaluru, B'lore",560058,AKPHS4620T,29AKPHS4620T4ZH,BBMP,group infosys steel,"806 3, 2nd cross, peenya 1st stage, bangalore, bangalore",True,True,AKPHS4620T,29AKPHS4620T4ZH
BBMP/560058/0637,Premier Valves Traders,"3rd Main, BEL Road, Bengaluru, 560058",560058,VHFPB8652I,,BBMP,premier traders valves,"3rd main, bel road, bangalore, 560058",True,False,VHFPB8652I,
BBMP/560058/0638,Southern Printing Entp,"445/4, Service Road, Peenya, Bengaluru, B'lore",560058,EATPI3145Y,,BBMP,enterprises printing southern,"445 4, service road, peenya, bangalore, bangalore",True,False,EATPI3145Y,
BBMP/560058/0642,Motors Royal & Co,"2nd Cross, Rajajinagar Industrial Estate, Bengaluru, 560058",560058,CMWCA3126X,29CMWCA3126X8ZT,BBMP,company motors royal,"2nd cross, rajajinagar industrial estate, bangalore, 560058",True,True,CMWCA3126X,29CMWCA3126X8ZT
BBMP/560058/0643,New Valves Manufacturers,"Ring Road, BEL Road, Bengaluru, 560058",560058,HBLPF4516D,29HBLPF4516D2Z5,BBMP,manufacturers new valves,"ring road, bel road, bangalore, 560058",True,True,HBLPF4516D,29HBLPF4516D2Z5
BBMP/560100/0645,Infosys Plastics Pvt Ltd,"2nd Cross, Kudlu Gate, Bengaluru, 560100",560100,HONFW0076Q,29HONFW0076Q6ZX,BBMP,infosys limited plastics private,"2nd cross, kudlu gate, bangalore, 560100",True,True,HONFW0076Q,29HONFW0076Q6ZX
BBMP/560058/0647,National Textiles Manufacturers,"3rd Main, Rajajinagar Industrial Estate, Bengaluru, B'lore",560058,ZDDCC0645X,,BBMP,manufacturers national textiles,"3rd main, rajajinagar industrial estate, bangalore, bangalore",True,False,ZDDCC0645X,
BBMP/560058/0648,Sunrise Foods Corporation,"763/8, Service Road, Peenya 1st Stage, Bengaluru, 560058",560058,AACAE5061V,,BBMP,corporation foods sunrise,"763 8, service road, peenya 1st stage, bangalore, 560058",True,False,AACAE5061V,
BBMP/560100/0649,Pipes Modern Private Limited,"348/8, Service Road, Bommanahalli, Bengaluru, B'lore",560100,,,BBMP,limited modern pipes private,"348 8, service road, bommanahalli, bangalore, bangalore",False,False,,
BBMP/560100/0651,Wipro Foundry Manufacturers,"609/9, Ring Road, Electronic City Phase 2, Bengaluru, 560100",560100,YDNHV3528U,29YDNHV3528U4ZZ,BBMP,foundry manufacturers wipro,"609 9, ring road, electronic city phase 2, bangalore, 560100",True,True,YDNHV3528U,29YDNHV3528U4ZZ
BBMP/560100/0652,Electronics Balaji Corporation,"Cross Road, Electronic City Phase 2, Bengaluru, 560100",560100,KTRPW4843F,,BBMP,balaji corporation electronics,"cross road, electronic city phase 2, bangalore, 560100",True,False,KTRPW4843F,
BBMP/560058/0653,Paper Janatha Co,"379/6, 3rd Main, Peenya 2nd Stage, Bengaluru, 560058",560058,WPHCI8284K,29WPHCI8284K9ZG,BBMP,company janatha paper,"379 6, 3rd main, peenya 2nd stage, bangalore, 560058",True,True,WPHCI8284K,29WPHCI8284K9ZG
BBMP/560058/0654,Bangalore Printing Co,"96/1, 1st Cross, Peenya, Bengaluru, B'lore",560058,ELHAF7193N,,BBMP,bangalore company printing,"96 1, 1st cross, peenya, bangalore, bangalore",True,False,ELHAF7193N,
BBMP/560058/0655,Plastics Balaji & Co,"2nd Cross, Peenya 1st Stage, Bengaluru, 560058",560058,UTGHM7678F,,BBMP,balaji company plastics,"2nd cross, peenya 1st stage, bangalore, 560058",True,False,UTGHM7678F,
BBMP/560058/0656,Rubber Premier Ltd,"743/8, 1st Cross, Peenya 1st Stage, Bengaluru, B'lore",560058,FCACI9961K,29FCACI9961K5ZE,BBMP,limited premier rubber,"743 8, 1st cross, peenya 1st stage, bangalore, bangalore",True,True,FCACI9961K,29FCACI9961K5ZE
BBMP/560058/0657,Titan Paints Pvt. Ltd.,"591/5, Service Road, Yeshwanthpur, Bengaluru, 560058",560058,TEVCP9594V,29TEVCP9594V4ZE,BBMP,limited paints private titan,"591 5, service road, yeshwanthpur, bangalore, 560058",True,True,TEVCP9594V,29TEVCP9594V4ZE
BBMP/560058/0658,Mphasis Valves Pvt. Ltd.,"Factory Road, Yeshwanthpur, Bengaluru, B'lore",560058,WZVAK2149M,29WZVAK2149M3ZM,BBMP,limited mphasis private valves,"factory road, yeshwanthpur, bangalore, bangalore",True,True,WZVAK2149M,29WZVAK2149M3ZM
BBMP/560100/0659,Electronics KS Limited,"Factory Road, Electronic City Phase 2, Bengaluru, 560100",560100,PPLPA1703L,29PPLPA1703L1ZA,BBMP,electronics ks limited,"factory road, electronic city phase 2, bangalore, 560100",True,True,PPLPA1703L,29PPLPA1703L1ZA
BBMP/560100/0660,Janatha Ceramics Group,"2nd Cross, Hosur Road, Bengaluru, B'lore",560100,BWQPM0113Z,,BBMP,ceramics group janatha,"2nd cross, hosur road, bangalore, bangalore",True,False,BWQPM0113Z,
BBMP/560058/0661,Cables Premier Private Limited,"768/5, 3rd Main, Peenya 1st Stage, Bengaluru, B'lore",560058,RAJAV8890I,29RAJAV8890I4ZC,BBMP,cables limited premier private,"768 5, 3rd main, peenya 1st stage, bangalore, bangalore",True,True,RAJAV8890I,29RAJAV8890I4ZC
BBMP/560058/0663,Karnataka Pharmaceuticals Factory,"3rd Main, Peenya, Bengaluru, B'lore",560058,XUJHK2925N,29XUJHK2925N3Z0,BBMP,factory karnataka pharmaceuticals,"3rd main, peenya, bangalore, bangalore",True,True,XUJHK2925N,29XUJHK2925N3Z0
BBMP/560058/0664,New Foods International,"1/3, Cross Road, Yeshwanthpur, Bengaluru, B'lore",560058,YGGAL9047N,,BBMP,foods international new,"1 3, cross road, yeshwanthpur, bangalore, bangalore",True,False,YGGAL9047N,
BBMP/560058/0665,Garments United Limited,"250/3, 2nd Cross, Rajajinagar Industrial Estate, Bengaluru, 560058",560058,ZWRFF8178L,29ZWRFF8178L7ZJ,BBMP,garments limited united,"250 3, 2nd cross, rajajinagar industrial estate, bangalore, 560058",True,True,ZWRFF8178L,29ZWRFF8178L7ZJ
BBMP/560058/0668,Karnataka Pumps Works,"Industrial Road, Peenya 1st Stage, Bengaluru, 560058",560058,WPBAD8138M,,BBMP,karnataka pumps works,"industrial road, peenya 1st stage, bangalore, 560058",True,False,WPBAD8138M,
BBMP/560100/0669,Steel Peoples Limited,"Main Road, Neeladri Nagar, Bengaluru, 560100",560100,DRUFK5235C,29DRUFK5235C8ZG,BBMP,limited peoples steel,"main road, neeladri nagar, bangalore, 560100",True,True,DRUFK5235C,29DRUFK5235C8ZG
BBMP/560100/0672,Valves Global Works,"923/9, Industrial Road, Electronic City Phase 1, Bengaluru, 560100",560100,MSZHP2261C,29MSZHP2261C3ZW,BBMP,global valves works,"923 9, industrial road, electronic city phase 1, bangalore, 560100",True,True,MSZHP2261C,29MSZHP2261C3ZW
BBMP/560100/0673,Metals Lakshmi Group,"Main Road, Neeladri Nagar, Bengaluru, B'lore",560100,,,BBMP,group lakshmi metals,"main road, neeladri nagar, bangalore, bangalore",False,False,,
BBMP/560100/0674,Leather Southern Factory,"Ring Road, Bommanahalli, Bengaluru, B'lore",560100,MJRAE7026T,,BBMP,factory leather southern,"ring road, bommanahalli, bangalore, bangalore",True,False,MJRAE7026T,
BBMP/560058/0676,Motors Star Factory,"Industrial Road, Peenya, Bengaluru, 560058",560058,CCZAT4701E,,BBMP,factory motors star,"industrial road, peenya, bangalore, 560058",True,False,CCZAT4701E,
BBMP/560100/0677,Valves Indian & Co,"3rd Main, Electronic City Phase 2, Bengaluru, 560100",560100,TZJCM2759B,,BBMP,company indian valves,"3rd main, electronic city phase 2, bangalore, 560100",True,False,TZJCM2759B,
BBMP/560058/0678,Foundry Royal Enterprises,"Ring Road, Peenya, Bengaluru, 560058",560058,UMQCR5766Z,29UMQCR5766Z2ZF,BBMP,enterprises foundry royal,"ring road, peenya, bangalore, 560058",True,True,UMQCR5766Z,29UMQCR5766Z2ZF
BBMP/560058/0679,Srinivasa Paper Limited,"192/3, Factory Road, Yeshwanthpur, Bengaluru, 560058",560058,NGHHT6184Z,29NGHHT6184Z6ZB,BBMP,limited paper srinivasa,"192 3, factory road, yeshwanthpur, bangalore, 560058",True,True,NGHHT6184Z,29NGHHT6184Z6ZB
BBMP/560100/0680,Motors Star Traders,"470/2, 3rd Main, Electronic City Phase 1, Bengaluru, B'lore",560100,VFJAZ3752O,,BBMP,motors star traders,"470 2, 3rd main, electronic city phase 1, bangalore, bangalore",True,False,VFJAZ3752O,
BBMP/560058/0681,Indian Furniture Enterprises,"Main Road, BEL Road, Bengaluru, 560058",560058,BXTAC0734A,,BBMP,enterprises furniture indian,"main road, bel road, bangalore, 560058",True,False,BXTAC0734A,
BBMP/560100/0682,Karnataka Printing Mfg,"709/1, Factory Road, Kudlu Gate, Bengaluru, 560100",560100,,,BBMP,karnataka manufacturing printing,"709 1, factory road, kudlu gate, bangalore, 560100",False,False,,
BBMP/560058/0683,Srinivasa Valves & Co,"Ring Road, BEL Road, Bengaluru, 560058",560058,,,BBMP,company srinivasa valves,"ring road, bel road, bangalore, 560058",False,False,,
BBMP/560100/0684,KS Printing Ind,"2nd Cross, Electronic City Phase 2, Bengaluru, 560100",560100,MGRFY7789H,29MGRFY7789H6Z3,BBMP,industries ks printing,"2nd cross, electronic city phase 2, bangalore, 560100",True,True,MGRFY7789H,29MGRFY7789H6Z3
BBMP/560058/0685,Ceramics Royal Limited,"111/3, 1st Cross, Peenya 2nd Stage, Bengaluru, 560058",560058,TYZFB5275F,29TYZFB5275F1ZL,BBMP,ceramics limited royal,"111 3, 1st cross, peenya 2nd stage, bangalore, 560058",True,True,TYZFB5275F,29TYZFB5275F1ZL
BBMP/560058/0687,Raghavendra Valves Private Limited,"706/4, 3rd Main, BEL Road, Bengaluru, 560058",560058,JMDFM8725I,29JMDFM8725I2ZT,BBMP,limited private raghavendra valves,"706 4, 3rd main, bel road, bangalore, 560058",True,True,JMDFM8725I,29JMDFM8725I2ZT
BBMP/560058/0689,Lakshmi Engineering Limited,"Service Road, Peenya 1st Stage, Bengaluru, 560058",560058,PRDCH2382F,29PRDCH2382F2ZW,BBMP,engineering lakshmi limited,"service road, peenya 1st stage, bangalore, 560058",True,True,PRDCH2382F,29PRDCH2382F2ZW
BBMP/560100/0690,Indian Pumps Pvt Ltd,"233/7, Ring Road, Electronic City Phase 1, Bengaluru, 560100",560100,HXGHL4746H,29HXGHL4746H9ZL,BBMP,indian limited private pumps,"233 7, ring road, electronic city phase 1, bangalore, 560100",True,True,HXGHL4746H,29HXGHL4746H9ZL
BBMP/560058/0691,Bangalore Rubber Corporation,"3rd Main, BEL Road, Bengaluru, B'lore",560058,IXBAL5041X,,BBMP,bangalore corporation rubber,"3rd main, bel road, bangalore, bangalore",True,False,IXBAL5041X,
BBMP/560100/0692,National Steel Entp,"Factory Road, Neeladri Nagar, Bengaluru, B'lore",560100,UYNCX8616N,,BBMP,enterprises national steel,"factory road, neeladri nagar, bangalore, bangalore",True,False,UYNCX8616N,
BBMP/560058/0696,Engineering Titan Pvt.Ltd,"835/2, 3rd Main, Peenya Industrial Area, Bengaluru, 560058",560058,GIGCD5177E,29GIGCD5177E7Z4,BBMP,engineering limited private titan,"835 2, 3rd main, peenya industrial area, bangalore, 560058",True,True,GIGCD5177E,29GIGCD5177E7Z4
BBMP/560100/0699,United Auto Parts Pvt Ltd,"738/7, Industrial Road, Neeladri Nagar, Bengaluru, B'lore",560100,PXTCK8001T,29PXTCK8001T8ZZ,BBMP,auto limited parts private united,"738 7, industrial road, neeladri nagar, bangalore, bangalore",True,True,PXTCK8001T,29PXTCK8001T8ZZ
BBMP/560058/0701,Peoples Printing & Co,"Factory Road, Peenya 1st Stage, Bengaluru, 560058",560058,WKLCK6867Q,29WKLCK6867Q5Z2,BBMP,company peoples printing,"factory road, peenya 1st stage, bangalore, 560058",True,True,WKLCK6867Q,29WKLCK6867Q5Z2
BBMP/560058/0702,KS Packaging P Limited,"87/2, 3rd Main, Peenya, Bengaluru, B'lore",560058,YINAP8665W,,BBMP,ks limited p packaging,"87 2, 3rd main, peenya, bangalore, bangalore",True,False,YINAP8665W,
BBMP/560058/0703,Global Ceramics P Limited,"963/4, Main Road, Peenya 2nd Stage, Bengaluru, 560058",560058,XVIHD2456B,29XVIHD2456B4ZF,BBMP,ceramics global limited p,"963 4, main road, peenya 2nd stage, bangalore, 560058",True,True,XVIHD2456B,29XVIHD2456B4ZF
BBMP/560058/0704,Bengaluru Pipes Manufacturers,"299/6, 3rd Main, Rajajinagar Industrial Estate, Bengaluru, B'lore",560058,ISDFA9279B,29ISDFA9279B4Z8,BBMP,bangalore manufacturers pipes,"299 6, 3rd main, rajajinagar industrial estate, bangalore, bangalore",True,True,ISDFA9279B,29ISDFA9279B4Z8
BBMP/560058/0705,Ceramics JSW Factory,"319/5, Main Road, Rajajinagar Industrial Estate, Bengaluru, B'lore",560058,XCVCQ7145W,29XCVCQ7145W4ZJ,BBMP,ceramics factory jsw,"319 5, main road, rajajinagar industrial estate, bangalore, bangalore",True,True,XCVCQ7145W,29XCVCQ7145W4ZJ
BBMP/560100/0708,Mahalaxmi Foundry Ltd,"249/9, Industrial Road, Electronic City Phase 1, Bengaluru, 560100",560100,,,BBMP,foundry limited mahalaxmi,"249 9, industrial road, electronic city phase 1, bangalore, 560100",False,False,,
BBMP/560100/0710,Pumps Janatha International,"510/3, Ring Road, Electronic City Phase 1, Bengaluru, 560100",560100,WGDCX9290G,29WGDCX9290G7ZJ,BBMP,international janatha pumps,"510 3, ring road, electronic city phase 1, bangalore, 560100",True,True,WGDCX9290G,29WGDCX9290G7ZJ
BBMP/560100/0711,Wipro Leather Pvt Ltd,"392/2, 3rd Main, Kudlu Gate, Bengaluru, 560100",560100,MFQCG1743W,29MFQCG1743W3Z3,BBMP,leather limited private wipro,"392 2, 3rd main, kudlu gate, bangalore, 560100",True,True,MFQCG1743W,29MFQCG1743W3Z3
BBMP/560100/0712,Garments Bangalore Mfg,"593/4, 1st Cross, Kudlu Gate, Bengaluru, B'lore",560100,VYCHN7358I,,BBMP,bangalore garments manufacturing,"593 4, 1st cross, kudlu gate, bangalore, bangalore",True,False,VYCHN7358I,
BBMP/560100/0713,Bangalore Steel Private Limited,"386/9, Industrial Road, Bommanahalli, Bengaluru, 560100",560100,LGIAJ8715B,29LGIAJ8715B1ZC,BBMP,bangalore limited private steel,"386 9, industrial road, bommanahalli, bangalore, 560100",True,True,LGIAJ8715B,29LGIAJ8715B1ZC
BBMP/560100/0714,Furniture Southern Pvt Ltd,"1st Cross, Neeladri Nagar, Bengaluru, 560100",560100,LCGFY8208L,29LCGFY8208L6Z9,BBMP,furniture limited private southern,"1st cross, neeladri nagar, bangalore, 560100",True,True,LCGFY8208L,29LCGFY8208L6Z9
BBMP/560100/0716,Peoples Pumps Factory,"749/1, Factory Road, Neeladri Nagar, Bengaluru, 560100",560100,,,BBMP,factory peoples pumps,"749 1, factory road, neeladri nagar, bangalore, 560100",False,False,,
BBMP/560100/0718,Auto New Parts Industries,"511/8, Factory Road, Electronic City Phase 2, Bengaluru, 560100",560100,GAGFD4512V,,BBMP,auto industries new parts,"511 8, factory road, electronic city phase 2, bangalore, 560100",True,False,GAGFD4512V,
BBMP/560058/0719,Raghavendra Rubber Ltd,"2nd Cross, Peenya Industrial Area, Bengaluru, 560058",560058,MGOCN9634U,29MGOCN9634U9ZR,BBMP,limited raghavendra rubber,"2nd cross, peenya industrial area, bangalore, 560058",True,True,MGOCN9634U,29MGOCN9634U9ZR
BBMP/560100/0720,Printing Janatha Traders,"522/9, Cross Road, Electronic City Phase 2, Bengaluru, 560100",560100,,,BBMP,janatha printing traders,"522 9, cross road, electronic city phase 2, bangalore, 560100",False,False,,
BBMP/560058/0721,Lakshmi Leather Traders,"875/2, Industrial Road, Peenya, Bengaluru, B'lore",560058,CXNPH9027J,29CXNPH9027J5ZY,BBMP,lakshmi leather traders,"875 2, industrial road, peenya, bangalore, bangalore",True,True,CXNPH9027J,29CXNPH9027J5ZY
BBMP/560058/0722,Lakshmi Fabrics Traders,"411/2, Industrial Road, BEL Road, Bengaluru, B'lore",560058,VNRAX3973E,,BBMP,fabrics lakshmi traders,"411 2, industrial road, bel road, bangalore, bangalore",True,False,VNRAX3973E,
BBMP/560058/0723,Venkateshwara Beverages & Co,"493/4, Service Road, Peenya Industrial Area, Bengaluru, 560058",560058,NUEHB1318F,29NUEHB1318F5Z1,BBMP,beverages company venkateshwara,"493 4, service road, peenya industrial area, bangalore, 560058",True,True,NUEHB1318F,29NUEHB1318F5Z1
BBMP/560100/0724,Infosys Printing Ltd,"Factory Road, Kudlu Gate, Bengaluru, 560100",560100,JMWPE1287G,29JMWPE1287G2ZR,BBMP,infosys limited printing,"factory road, kudlu gate, bangalore, 560100",True,True,JMWPE1287G,29JMWPE1287G2ZR
BBMP/560100/0728,Venkateshwara Packaging Limited,"369/9, 3rd Main, Bommanahalli, Bengaluru, 560100",560100,SZFCT1255M,29SZFCT1255M5ZB,BBMP,limited packaging venkateshwara,"369 9, 3rd main, bommanahalli, bangalore, 560100",True,True,SZFCT1255M,29SZFCT1255M5ZB
BBMP/560100/0729,Fabrics Royal Ltd,"2nd Cross, Neeladri Nagar, Bengaluru, 560100",560100,RKLAE9314X,29RKLAE9314X9Z6,BBMP,fabrics limited royal,"2nd cross, neeladri nagar, bangalore, 560100",True,True,RKLAE9314X,29RKLAE9314X9Z6
BBMP/560100/0730,Premier Rubber Ltd,"3rd Main, Kudlu Gate, Bengaluru, B'lore",560100,GRXPU0395R,29GRXPU0395R6ZK,BBMP,limited premier rubber,"3rd main, kudlu gate, bangalore, bangalore",True,True,GRXPU0395R,29GRXPU0395R6ZK
BBMP/560100/0731,Global Electronics Group,"Cross Road, Electronic City Phase 2, Bengaluru, 560100",560100,,,BBMP,electronics global group,"cross road, electronic city phase 2, bangalore, 560100",False,False,,
BBMP/560100/0732,Star Motors Mfr,"Industrial Road, Hosur Road, Bengaluru, B'lore",560100,AQDPA7580Z,29AQDPA7580Z3ZO,BBMP,manufacturer motors star,"industrial road, hosur road, bangalore, bangalore",True,True,AQDPA7580Z,29AQDPA7580Z3ZO
